adidas-yeezy-boost-350-v2-multi-color-f-f,adidas,adidas nemeziz 19+ firm ground cleat active red,New,¥21700,9,¥15600,¥8400,+9100,72,Active Red/Silver Metallic/Solar Red,275,06/01/2019,26400,12200,17300,26000,20.1,9,-25.5,"16,800"
adidas-yeezy-boost-350-v2-multi-color-f-f,adidas,adidas predator accelerator firm ground cleat black white red,New,¥42100,13,¥84200,¥31700,-15800,-27,Core Black/Cloud White/Red,350,08/23/2018,63200,36900,32500,51800,22.9,8,14.1,"47,600"
adidas-yeezy-boost-350-v2-multi-color-f-f,adidas,adidas copa mid gosha rubchinskiy white black,New,¥14800,7,¥14800,¥11000,+2800,23,Footwear White/Footwear White/Footwear White,--,--,18200,12100,12700,16900,14.5,6,--,"15,500"
adidas-yeezy-boost-350-v2-multi-color-f-f,adidas,adidas predator tango 18+ white black coral,New,¥4800,11,¥5200,¥5200,+600,13,Footwear White/Core Black/Real Coral,200,02/07/2018,11600,4300,1900,7600,60.0,6,-77.5,"7,700"
adidas-yeezy-boost-350-v2-multi-color-f-f,adidas,adidas nemeziz tango 18.1 core black,New,¥8000,8,¥10600,--,-2600,-25,Core Black/Core Black/Footwear White,130,07/21/2018,11500,6400,6300,9600,21.4,6,-42.3,"9,100"
adidas-yeezy-boost-350-v2-multi-color-f-f,adidas,adidas predator accelerator fg solar yellow,New,¥31700,13,¥47500,¥30400,+4300,15,Solar Yellow/Core Black/Solar Red,350,07/05/2018,42100,12200,21700,41700,31.8,6,-14.3,"31,800"
adidas-yeezy-boost-350-v2-multi-color-f-f,adidas,adidas copa mid gosha rubchinskiy solar yellow,New,¥16000,11,¥16100,¥5200,-4000,-20,Solar Yellow/Solar Yellow/Solar Yellow,250,01/01/2018,20000,10300,12600,19200,21.2,5,-39.8,"14,600"
adidas-yeezy-boost-350-v2-multi-color-f-f,adidas,adidas predator precision fg blue grey collegiate red,New,¥49700,11.5,¥36900,¥12100,+20200,68,Blue Grey/Cloud White/Collegiate Red,330,01/01/2017,49700,23800,39000,60300,21.5,4,42.8,"37,000"
adidas-yeezy-boost-350-v2-multi-color-f-f,adidas,adidas accelerator turf david beckham red,New,¥17400,10.5,¥23800,¥10500,-400,-2,--,220,11/01/2017,27500,17400,12800,22100,26.6,3,-25.0,"20,900"
adidas-yeezy-boost-350-v2-multi-color-f-f,adidas,adidas purecontrol firm ground cleats paul pogba,New,¥36400,10,¥57100,¥13100,-2600,-7,--,330,01/16/2017,39000,36400,35300,37600,3.1,3,4.5,"37,500"
adidas-yeezy-boost-350-v2-multi-color-f-f,adidas,adidas copa mundial 17 cleat kith cobras,New,¥16900,11,--,¥28400,+5300,45,--,300,06/02/2017,16900,11600,14300,19500,15.6,2,-46.7,"14,300"
adidas-yeezy-boost-350-v2-multi-color-f-f,adidas,adidas nemeziz messi 19.1 firm ground cleat white solar red football blue,New,¥18500,8.5,¥22500,¥10500,+7600,70,Cloud White/Solar Red/Football Blue,225,06/01/2019,18500,10900,14700,22300,20.6,2,-22.2,"14,700"
adidas-yeezy-boost-350-v2-multi-color-f-f,adidas,adidas ace tango 17.1 purecontrol tf paul pogba,New,¥12000,8.5,--,¥9400,-3400,-22,--,200,01/16/2017,15300,12000,10200,13600,14.4,2,-43.7,"13,600"
adidas-yeezy-boost-350-v2-multi-color-f-f,adidas,adidas indoor comp spezial cloud white,New,¥15800,11.5,--,¥11100,0,0,Cloud White/Black/Clear Brown,120,09/07/2018,15800,15800,14200,17300,--,1,24.2,"15,800"
adidas-yeezy-boost-350-v2-multi-color-f-f,adidas,adidas copa 19.1 firm ground cleat off white solar red,New,¥3700,11,--,¥3700,0,0,Off White/Solar Red/Core Black,210,11/13/2018,3700,3700,3400,4200,--,1,-83.3,"3,700"
adidas-yeezy-boost-350-v2-multi-color-f-f,adidas,adidas nemeziz tango 17.1 kith rays,New,¥8000,10.5,¥25900,¥7900,0,0,--,150,11/03/2017,8000,8000,7200,8800,--,1,-49.8,"8,000"
