adidas-yeezy-boost-350-v2-multi-color-f-f,adidas,adidas ultra boost dna chinese new year (2020),New,¥15800,10,¥10100,¥12600,+3200,25,Core Black/Core Black/Gold Metallic,180,01/24/2020,21100,8800,12700,18700,18.9,673,-17.4,"13,100"
adidas-yeezy-boost-350-v2-multi-color-f-f,adidas,adidas ultra boost dna black purple,New,¥10300,11.5,¥9100,¥11900,-1200,-11,Core Black/Core Black/Gold Metallic,180,02/11/2020,21100,4300,8900,11600,13.0,389,-46.1,"13,000"
adidas-yeezy-boost-350-v2-multi-color-f-f,adidas,adidas ultra boost all terrain shock red yellow,New,¥7000,8.5,¥7200,¥14200,-1000,-13,Black/Shock Red-Shock Yellow,180,10/02/2019,25900,3000,6100,8000,13.2,387,-63.3,"10,400"
adidas-yeezy-boost-350-v2-multi-color-f-f,adidas,adidas ultra boost beyonce ivy park,New,¥23100,10.5,¥21100,¥30500,+10000,75,Maroon/Maroon/Solar Orange,200,01/18/2020,53500,2700,17200,29000,25.6,1825,9.5,"25,100"
adidas-yeezy-boost-350-v2-multi-color-f-f,adidas,adidas ultraboost 20 triple white,New,¥9000,12,¥9500,¥10000,-1200,-12,Cloud White,180,12/06/2019,15900,6400,7700,10300,13.9,935,-52.8,"10,800"
adidas-yeezy-boost-350-v2-multi-color-f-f,adidas,adidas ultra boost solar yellow (2019),New,¥10600,10,¥10300,¥21000,+200,1,Solar Yellow/Solar Yellow/Core Black,180,10/03/2019,35400,8000,8700,12500,18.4,677,-44.4,"14,300"
adidas-yeezy-boost-350-v2-multi-color-f-f,adidas,adidas ultra boost grey silver,New,¥8000,10.5,¥8000,¥14200,+100,0,Grey Four/Silver Metallic/Core Black,180,11/04/2019,31500,6500,6800,9100,14.6,482,-58.3,"10,600"
adidas-yeezy-boost-350-v2-multi-color-f-f,adidas,adidas ultra boost dna chinese new year white (2020),New,¥13500,9.5,¥11800,¥18400,+2500,22,Crayon White/Crayon White/Gold Metallic,180,01/23/2019,37800,8000,7400,19700,45.6,2168,-28.9,"17,100"
adidas-yeezy-boost-350-v2-multi-color-f-f,adidas,adidas ultra boost 4.0 grey three,New,¥12700,13,¥12500,¥18900,-300,-2,--,180,11/17/2017,25400,8200,11400,14000,10.3,2031,-33.3,"14,700"
adidas-yeezy-boost-350-v2-multi-color-f-f,adidas,adidas ultra boost 2020 iss us national lab core black,New,¥14600,8.5,¥10600,¥22200,+300,2,Core Black/Core Black/Blue Violet Metallic,180,12/05/2019,30600,6400,12200,17000,16.6,1987,-23.2,"13,200"
adidas-yeezy-boost-350-v2-multi-color-f-f,adidas,adidas ultra boost disney goofy,New,¥12700,11,¥12000,¥14200,-1500,-11,Black/Black/Black,180,--,34300,7400,10500,14900,17.6,173,-33.3,"15,900"
adidas-yeezy-boost-350-v2-multi-color-f-f,adidas,adidas ultra boost dna parley black (2020),New,¥7500,8.5,¥10600,¥13700,-4100,-35,Core Black/Core Black/Blue Spirit,180,06/08/2020,34300,7500,5400,9600,28.0,325,-60.6,"16,000"
adidas-yeezy-boost-350-v2-multi-color-f-f,adidas,adidas ultra boost 1.0 texas a&m,New,¥13800,11,¥12100,¥15200,-2000,-13,Team Maroon/Cloud White/Team College Burgundy,180,09/04/2020,36900,8500,11200,16300,18.4,104,-27.8,"15,300"
adidas-yeezy-boost-350-v2-multi-color-f-f,adidas,adidas ultra boost 1.0 nebraska,New,¥13200,12,¥12700,¥12100,+1600,14,Team Power Red/Core Black/Active Red,180,09/04/2020,26100,10100,11600,14800,11.9,55,-30.6,"13,900"
adidas-yeezy-boost-350-v2-multi-color-f-f,adidas,adidas ultra boost 2 city stars and stripes,New,¥6600,9.5,¥8000,¥11300,-1700,-22,Core Black/Blue/Scarlet,180,06/01/2019,21100,5800,3900,9200,40.5,788,-65.6,"11,500"
adidas-yeezy-boost-350-v2-multi-color-f-f,adidas,adidas ultra boost 4d uncaged parley black,New,¥34700,11,¥21100,¥30000,+3600,12,Core Black/Core Black/Blue Spirit,200,08/07/2020,61100,24300,27200,42200,21.4,452,64.5,"35,400"
adidas-yeezy-boost-350-v2-multi-color-f-f,adidas,adidas ultra boost 2020 iss us national lab core black blue violet,New,¥11000,8,¥10300,¥9400,-1200,-10,Core Black/Core Black/Blue Violet Metallic,180,12/05/2019,25900,4300,8300,13800,25.2,375,-42.2,"12,500"
adidas-yeezy-boost-350-v2-multi-color-f-f,adidas,adidas ultra boost 2019 footwear white,New,¥10100,8.5,¥9900,¥11500,-5200,-34,Footwear White/Footwear White/Core Black,180,01/01/2019,18000,5300,8500,11600,16.2,1835,-47.2,"10,800"
adidas-yeezy-boost-350-v2-multi-color-f-f,adidas,adidas ultra boost 2019 triple black,New,¥12500,12,¥9800,¥10500,+1900,18,Core Black/Core Black/Solar Orange,180,07/18/2019,18900,6400,11400,13500,8.8,1220,-34.4,"11,700"
adidas-yeezy-boost-350-v2-multi-color-f-f,adidas,adidas ultra boost dna grey silver,New,¥10000,9,¥8700,¥9400,-400,-4,Grey Five/Silver Metallic/Grey Three,180,12/10/2019,26100,7400,8900,11000,10.5,245,-47.8,"11,600"
adidas-yeezy-boost-350-v2-multi-color-f-f,adidas,adidas ultra boost 1.0 asu,New,¥12600,10.5,¥12400,¥15800,+1100,9,Team College Gold/Team Maroon/Solar Gold,180,09/04/2020,25600,11400,10400,14800,17.4,136,-33.9,"15,900"
adidas-yeezy-boost-350-v2-multi-color-f-f,adidas,adidas ultra boost 2020 iss us national lab dash grey,New,¥9700,9.5,¥9900,¥13700,+100,1,Dash Grey/Grey Three/Blue Violet Metallic,180,12/05/2019,23800,8000,7800,11600,19.5,1267,-49.0,"12,500"
adidas-yeezy-boost-350-v2-multi-color-f-f,adidas,adidas ultra boost 4.0 non dye cloud white,New,¥20000,11,¥14800,¥17700,+1500,8,Non Dyed/Cloud White/Grey,180,11/30/2018,29700,6400,17700,22300,11.5,1248,5.0,"15,900"
adidas-yeezy-boost-350-v2-multi-color-f-f,adidas,adidas ultra boost 4.0 game of thrones nights watch,New,¥14300,10,¥8500,¥20000,-9100,-39,Grey/Black/White,180,03/22/2019,31600,5300,10300,18300,28.3,854,-25.0,"12,800"
adidas-yeezy-boost-350-v2-multi-color-f-f,adidas,adidas ultra boost undefeated blackout,New,¥15900,7,¥13800,¥25200,+2700,20,Black/Grey/Black,200,06/28/2019,34300,9500,14200,17500,11.0,603,-25.0,"17,000"
adidas-yeezy-boost-350-v2-multi-color-f-f,adidas,adidas ultra boost 4.0 black multi-color white heel cage,New,¥10500,11.5,¥10100,¥12600,-3200,-24,Core Black/Core Black/Active Red,180,01/01/2019,18500,5300,8800,12200,16.0,454,-45.0,"12,300"
adidas-yeezy-boost-350-v2-multi-color-f-f,adidas,adidas ultra boost 19 solar red core black,New,¥7500,13,¥7300,¥8400,+1200,18,Solar Red/Core Black/Solar Red,180,11/30/2019,18900,4400,6300,8800,16.3,351,-60.6,"9,300"
adidas-yeezy-boost-350-v2-multi-color-f-f,adidas,adidas ultra boost shock yellow,New,¥8300,9.5,¥6900,¥8700,+1000,13,Collegiate Navy/Core Black/Shock Yellow,180,08/20/2019,19000,5800,6700,9900,19.7,168,-56.7,"9,700"
adidas-yeezy-boost-350-v2-multi-color-f-f,adidas,adidas ultra boost scarlet (2020),New,¥12500,12,¥9200,¥12100,+2600,26,Scarlet/Scarlet/Scarlet,180,06/08/2020,26600,8200,11200,13800,10.5,100,-34.4,"14,400"
adidas-yeezy-boost-350-v2-multi-color-f-f,adidas,adidas ultra boost 1.0 washington,New,¥11500,9.5,¥10800,¥11200,-300,-3,Team College Purple/Gold Metallic/Night Flash,180,09/04/2020,23000,10600,10000,13100,13.5,178,-39.4,"13,300"
